{
  "schemaVersion": "0.1.0",
  "$schema": "https://kindlight.io/schemas/gist-registry/skills/0.1.0/public-skill-catalog.schema.json",
  "repository": "gist-registry",
  "canonicalUrl": "https://kindlight.io/skills/index.json",
  "sourceRevision": "60a37573b2be6ef423130c45b07639165acc11f8",
  "publicationScope": "Every listed entry has public-ready standing and an exact source package in this projection.",
  "skills": [
    {
      "name": "architecture-convergence-vantages",
      "title": "Architecture convergence vantages",
      "description": "Coordinates bounded technical vantages around a consequential implementation choice and synthesizes one guarantee map, fitting architecture, and receiving route. Applies when several plausible changes affect concurrency, recovery, portability, evidence, or publication differently.",
      "publicationStanding": "public_ready",
      "evidenceStanding": "exercised",
      "canonicalUrl": "https://kindlight.io/skills/architecture-convergence-vantages/",
      "source": {
        "repositoryPath": ".agents/skills/architecture-convergence-vantages/SKILL.md",
        "publishedPath": "/skills/source/.agents/skills/architecture-convergence-vantages/SKILL.md",
        "sha256": "ded73eed82ad3ce48d8c008b6fb7799b6787d0e25381b121bea4f4adb4a32d5f",
        "repositoryUrl": "https://github.com/driftframestudios/gist-registry/blob/60a37573b2be6ef423130c45b07639165acc11f8/.agents/skills/architecture-convergence-vantages/SKILL.md"
      },
      "dependencies": [
        {
          "repositoryPath": ".agents/skills/architecture-convergence-vantages/references/filesystem-state-transitions.md",
          "publishedPath": "/skills/source/.agents/skills/architecture-convergence-vantages/references/filesystem-state-transitions.md",
          "sha256": "45fe584da4bec3195e07f34257600d472bdcfcb2edbb714be9d7a111ff5994e0",
          "repositoryUrl": "https://github.com/driftframestudios/gist-registry/blob/60a37573b2be6ef423130c45b07639165acc11f8/.agents/skills/architecture-convergence-vantages/references/filesystem-state-transitions.md"
        }
      ]
    },
    {
      "name": "contextual-jargon-scan",
      "title": "Contextual jargon scan",
      "description": "Classifies potentially specialist or inside wording within a bounded corpus and revises replaceable shorthand into ordinary language. Applies when Registry orientation, artifact documentation, public projection copy, or cross-team prose may rely on context its reader does not share.",
      "publicationStanding": "public_ready",
      "evidenceStanding": "exercised",
      "canonicalUrl": "https://kindlight.io/skills/contextual-jargon-scan/",
      "source": {
        "repositoryPath": ".agents/skills/contextual-jargon-scan/SKILL.md",
        "publishedPath": "/skills/source/.agents/skills/contextual-jargon-scan/SKILL.md",
        "sha256": "897557f83607b23c82eb2029f31b0ae30a3819e1590b250cd4dfef877577eae7",
        "repositoryUrl": "https://github.com/driftframestudios/gist-registry/blob/60a37573b2be6ef423130c45b07639165acc11f8/.agents/skills/contextual-jargon-scan/SKILL.md"
      },
      "dependencies": []
    },
    {
      "name": "probe-bearing-exemplar-formation",
      "title": "Probe-bearing exemplar formation",
      "description": "Forms a first reviewable registry coordinate from a source-grounded technical question, focused evidence, and a named receiving use. Applies when a public-safe code sample, Practitioner Probe, or domain exemplar is ready for its first registry version.",
      "publicationStanding": "public_ready",
      "evidenceStanding": "exercised",
      "canonicalUrl": "https://kindlight.io/skills/probe-bearing-exemplar-formation/",
      "source": {
        "repositoryPath": ".agents/skills/probe-bearing-exemplar-formation/SKILL.md",
        "publishedPath": "/skills/source/.agents/skills/probe-bearing-exemplar-formation/SKILL.md",
        "sha256": "afaf2abe0dc5e88cbc404f3d1fe9b0dcaa9becf4e350acd39995429cbac3c633",
        "repositoryUrl": "https://github.com/driftframestudios/gist-registry/blob/60a37573b2be6ef423130c45b07639165acc11f8/.agents/skills/probe-bearing-exemplar-formation/SKILL.md"
      },
      "dependencies": []
    },
    {
      "name": "transaction-boundary-evidence-mapping",
      "title": "Transaction boundary evidence mapping",
      "description": "Maps a logical operation's meaning, accepted-state dependency, aligned effects, publication point, retry outcomes, and evidence owners. Applies when several state changes must become visible together or retry correctness depends on whether publication occurred.",
      "publicationStanding": "public_ready",
      "evidenceStanding": "exercised",
      "canonicalUrl": "https://kindlight.io/skills/transaction-boundary-evidence-mapping/",
      "source": {
        "repositoryPath": ".agents/skills/transaction-boundary-evidence-mapping/SKILL.md",
        "publishedPath": "/skills/source/.agents/skills/transaction-boundary-evidence-mapping/SKILL.md",
        "sha256": "5302b522eeb46d7afd7c6da043f9a858870c5fb560dc28467b309bd046828a3d",
        "repositoryUrl": "https://github.com/driftframestudios/gist-registry/blob/60a37573b2be6ef423130c45b07639165acc11f8/.agents/skills/transaction-boundary-evidence-mapping/SKILL.md"
      },
      "dependencies": []
    },
    {
      "name": "versioned-exemplar-successor",
      "title": "Versioned exemplar successor",
      "description": "Carries a material technical strengthening from an accepted registry artifact into a new runnable version and exact derived teaching surfaces. Applies when stronger implementation, comments, tests, or evidence would exceed an immutable version's demonstrated behavior.",
      "publicationStanding": "public_ready",
      "evidenceStanding": "exercised",
      "canonicalUrl": "https://kindlight.io/skills/versioned-exemplar-successor/",
      "source": {
        "repositoryPath": ".agents/skills/versioned-exemplar-successor/SKILL.md",
        "publishedPath": "/skills/source/.agents/skills/versioned-exemplar-successor/SKILL.md",
        "sha256": "74fca2cb1e918410ca72a0eda6165567d70fed49dc8367e6ea38a2bb0153f270",
        "repositoryUrl": "https://github.com/driftframestudios/gist-registry/blob/60a37573b2be6ef423130c45b07639165acc11f8/.agents/skills/versioned-exemplar-successor/SKILL.md"
      },
      "dependencies": []
    }
  ]
}
